"ontology_term","ontology_term_label","ontology_term_definition"
"cbcm:TransactionRight","Transaction right","A legal right of a legal entity involved in the process of a company transaction. A legal right here refers to the entitlement of a person to be allowed to perform an activity, or to possess or obtain access to an object."
"cbcm:Agent","Agent","An entity or group of entities (either biological or non-biological) that is able to perform actions autonomously in the world."
"cbcm:CompanyMobilityDocument","Company mobility document","A legal document which provides information related to, or influencing, a company's mobility within a specific country or across national boundaries."
"cbcm:Organisation","Organisation","Represents a collection of people organized together into a community or other social, commercial or political structure. The group has some common purpose or reason for existence which goes beyond the set of people belonging to it and can act as an Agent. Organizations are often decomposable into hierarchical structures."
"cbcm:Person","Person","A person is an object that has certain capacities or attributes constituting personhood. A human being that has existed or continues to exist in the world (either deceased or living). Fictional human beings cannot be  instances of this class."
"cbcm:CompanyTransaction","Company transaction","An action taken by a company that modifies its corporate structure with a change of control (for e.g. through either a merger, division, conversion or seat transfer in a domestic or cross-border setting). It involves one or more companies, each of which have a company legal form valid in a Member State of the European Union."
"cbcm:CompanyLegalForm","Company form","Name given to describe the structure of a corporation or business in the different legal orders. For example Limited (Ltd.), Public Limited Company (PLC), Gesellschaft mit beschränkter Haftung (GmbH), Aktiengesellschaft (AG). The company legal form is regulated under national law and grants specific rights and obligations to the company stakeholders (such as shareholders, management & employees)."
"cbcm:Country","Country","A geo-political region that has a distinct and common political governance structure for people that inhabit it for a significant portion of their lives. The majority of people that inhabit such a region are also usually united by common descent, history, culture and language."
"cbcm:DocumentRepository","Company mobility document repository","A digital document repository containing documents related to company mobility."
"cbcm:CompanyMerger","Company merger","‘merger’ in Directive (EU) 2017/1132 means an operation whereby:

(a) one or more companies, on being dissolved without going into liquidation, transfer all their assets and liabilities to another existing company, the acquiring company, in exchange for the issue to their members of securities or shares representing the capital of that other company and, if applicable, a cash payment not exceeding 10 % of the nominal value, or, in the absence of a nominal value, of the accounting par value of those securities or shares; or

(b) two or more companies, on being dissolved without going into liquidation, transfer all their assets and liabilities to a company that they form, the new company, in exchange for the issue to their members of securities or shares representing the capital of that new company and, if applicable, a cash payment not exceeding 10 % of the nominal value, or in the absence of a nominal value, of the accounting par value of those securities or shares; or

(c) a company, on being dissolved without going into liquidation, transfers all its assets and liabilities to the company holding all the securities or shares representing its capital;""

(d) one or more companies, on being dissolved without going into liquidation, transfer all their assets and liabilities to another existing company, the acquiring company, without the issue of any new shares by the acquiring company, provided that one person holds directly or indirectly all the shares in the merging companies or the members of the merging companies hold their shares in the same proportion in all merging companies."";"
"cbcm:Company","Company","A company is a legal entity formed by a group of individuals to engage in and operate a business—commercial or industrial—enterprise. A company may be organized in various ways for tax and financial liability purposes depending on the corporate law of its jurisdiction."
"cbcm:AcquiringCompany","Acquiring company","Acquiring Company means the resulting or surviving company in a transaction that takes over another, merging company."
"cbcm:MergingCompany","Merging company","Merging Company means the dissolving company that is being acquired by another (acquiring) company in the process of a transaction. In the context of company mobility, this means a universal transfer of assets and liabilities from the merging to the acquiring company (see article 131 of Directive 2017/1132)."
"cbcm:CompanyDivision","Company division","Article 160b - Division means:
a) company being divided, on being dissolved without going into liquidation, transfers all its assets and liabilities to two or more newly formed companies (‘the recipient companies’), in exchange for the issue to the members of the company being divided of securities or shares in the recipient companies and, if any, a cash payment not exceeding 10 % of the nominal value of those securities or shares or, where they have no nominal value, a cash payment not exceeding 10% of the accounting par value of their securities or shares ('full division');

(b) 	a company being divided transfers part of its assets and liabilities to one or more newly formed companies (‘the recipient companies’), in exchange for the issue to the members of the company being divided of securities or shares in the recipient companies or in the company being divided or in both the recipient companies and in the company being divided, and if any a cash payment not exceeding 10 % of the nominal value of those securities or shares, or in the absence of a nominal value, a cash payment not exceeding 10 % of the accounting par value of their securities or shares (‘partial division’).
   	
(c) 	a company being divided transfers part of its assets and liabilities to one or more newly formed companies (‘the recipient companies’), in exchange for the issue of securities or shares in the recipient companies to the company being divided (‘division by separation’)."
"cbcm:EmergingCompany","Emerging company","A company being divided transfers part of its assets and liabilities to one or more newly formed companies, which are the recipient companies in a (cross-border) division."
"cbcm:OriginalCompany","Original company","An original company, in the context of a (cross-border) division, means a company which - in case of a full division - transfers all its assets and liabilities to two or more companies, or - in case of a partial division or division by separation - transfers part of its assets and liabilities to one or more companies."
"cbcm:RecipientCompany","Recipient company","A company being divided transfers part of its assets and liabilities to one or more newly formed companies, which are the recipient companies in a (cross-border) division."
"cbcm:CompanyConversion","Company conversion","The process of changing or converting the corporate structure of a company. For example, a limited liability company of one country to one of another country, or from a private to a public limited liability company, or vice-versa by means of the continuance of an entity into another entity."
"cbcm:TransactionNotice","Company transaction notice","A written notice, published in an official journal of a Member State of the EU and/or the European Official Journal indicating the intention to engage in a transaction and which informs  the members, creditors and representatives of the employees of the company, or, where there are no such representatives, the employees themselves of said transaction."
"cbcm:SEType","Societas Europaea (SE) type","Variable indicating the SE-establishment mode: by merger, conversion, holding-SE, subsidiary-SE or unsure (cases)"
"cbcm:BoardLevelEmployeeRepresentationRight","Board-level employee representation right","Board-level representation of employees (BLER) refers to the phenomenon where employees or their representatives elect or appoint representatives to the strategic decision-making body of a company (i.e. the supervisory board or non-executive board in a one-tier system). The BLER right requires that if such a system of BLER exists prior to a cross-border company transaction, such a right must be upheld in the acquiring/recipient company under the ""before-and-after-principle""."
"cbcm:AnnualAccount","Annual account","Annual reports measure a company's financial health. They focus on past and present financial performance, and make predictions about future prospects. The revenue and financial performance of a company."
"cbcm:AnnualReport","Annual report","Annual reports measure a company's financial health. They focus on past and present financial performance, and make predictions about future prospects. The revenue and financial performance of a company."
"cbcm:Attribute","Attribute","An attribute is a characteristic of some entity."
"cbcm:Behaviour","Behaviour","Behaviour is the set of actions and mannerisms made by systems (biological or otherwise) in response to stimuli or inputs, whether internal or external, conscious or subconscious, overt or covert, and voluntary or involuntary."
"cbcm:Procedure","Procedure","A procedure is a process that attempts to achieve one or more objectives by following an established set of actions."
"cbcm:SocialRight","Social right","Social rights, as opposed to rights arising from natural law, are rights for legal entities that entitle them to certain levels of societal living conditions (e.g. the right to housing, to food, to health care etc.)"
"cbcm:BoardResolution","Board resolution","A Board Resolution, or Company Resolution, is a way of documenting a decision made by a Company's Board of Directors on behalf of the company. After the resolution is made during a meeting, a Board Resolution document is typically used to get the specifics of the resolution in writing."
"cbcm:Resolution","Resolution","A document detailing a decision made by an individual or group of natural or legal persons. This can be a decision concerning the restructuring of a company by its shareholders."
"cbcm:CBCMResearcher","Cross-border company mobility researcher","A person that is interested in research about cross-border company mobility, and actively collects and analyses data concerning cross-border company mobility."
"cbcm:City","City","A city (plural ""cities"") is a geo-political region in which there is a large human settlement. The distinction with the term ""town"" (plural ""towns"") is that cities are generally larger than towns. Countries are generally larger than cities and, in fact, usually consist of multiple cities."
"cbcm:GeoPoliticalRegion","Geo-political region","A spatial region on earth whose boundaries are determined by a combination of geographical, ecological, climatic, socio-economic and political criteria."
"cbcm:Employee","Company employee","The workforce of a company. An employee is a party to an employment relationship characterised as a contract of employment (or contract of service) between the employer and employee. However, this is only one of several different legal formulations of the concept of ‘worker’ in the EU which differ between Member States."
"cbcm:CompanyCentralAdministration","Central Administration","The headquarters or body of a company which governs it's financial and administrative activities"
"cbcm:CompanyRegisteredOffice","Registered office","The physical address or location at which the primary business activities of a company are carried out."
"cbcm:CompanyHeadQuarter","Company headquarter","The location of a company headquarter"
"cbcm:OrganisationalUnit","Organisational unit","A division of a large organization such as a government, university, or business, dealing with a specific area of activity."
"cbcm:ConversionPlan","Company conversion plan","A document providing details of how the conversion of a company will be implemented. Article 86d: The management or administrative organ of the company shall draw up the draft terms of a cross-border conversion. The draft terms of a cross-border conversion shall include at least the particulars listed in article 86d"
"cbcm:DivisionPlan","Company division plan","The management or administrative organ of the company shall draw up the draft terms of a division. The draft terms of a division shall include at least the particulars listed in article 160d."
"cbcm:MergerPlan","Company merger plan","Article 91: The administrative or management bodies of the merging companies shall draw up draft terms of merger in writing by specifying at least the elements mentioned in article 91."
"cbcm:CompanySeatTransfer","Company seat transfer","The act of changing the location where the company’s business was managed (registered office or headquarters) or the place where that company’s primary business was actually conducted (central administration)."
"cbcm:SeatTransferPlan","Company seat transfer plan","The management or administrative organ of the company draws up the draft terms of a cross-border seat transfer. The draft terms of a cross-border seat transfer must include at least the particulars specified under national law."
"cbcm:TransferOfCentralAdministration","Transfer of company central administration","Act of modifying the location where the company’s business was managed or the place where that company’s business was actually conducted."
"cbcm:TransferOfRegisteredOffice","Transfer of company registered office","The act of changing the registered office, which is the official address of an incorporated company, association or any other legal entity."
"cbcm:CompanyShareholder","Company shareholder","An individual, group, or organization that owns one or more shares in a company, and in whose name the share certificate is issued."
"cbcm:CompanyStakeholder","Stakeholder in a company","A person, group or organization that has interest or concern in an organization or company in particular. Stakeholders can affect or be affected by the company's actions, objectives and policies."
"cbcm:TransactionCertificate","Company transaction certificate","A document issued by a Competent Authority declaring that certain steps of the transaction are completed."
"cbcm:CompetentAuthority","Competent authority","The monitoring of the completion and legality of the decision-making process in each company involved in a transaction is carried out by a national authority having jurisdiction over each of those companies. The national authority could be a court, a notary or any other competent authority appointed by the Member State concerned."
"cbcm:ConsultationRight","Consultation right","The right of employees or their representatives to be consulted and to give advice on a business decision, such as an intended merger/division/conversion/seat transfer."
"cbcm:ConversionCertificate","Company conversion certificate","A document issued by a Competent Authority declaring that the legally required steps of a conversion are completed. The certificate needs to be presented by a company to either be registered in another company registry or to be removed from a company register."
"cbcm:TransactionDocument","Transaction document","Document required by law to document the step of a company transaction or an agreement made between stakeholders involved in the transaction that are either printed, inserted and mailed, or electronically presented."
"cbcm:Court","Court","Legal forum in which a body of people presided over by a judge, judges, or magistrate, and acting as a tribunal in civil and criminal cases resolve legal disputes."
"cbcm:Creditor","Creditor","A person, organization, or government that is owed money. A creditor's claims and the safeguarding of these creditor rights is laid down in the company law of the Member States and EU law."
"cbcm:CreditorDecisionRight","Creditor decision right","The right of a creditor to influence or take a decision in the context of a transaction."
"cbcm:CreditorRight","Creditor right","The rights of creditors, which includes debenture holders, vis-a-vis the company that obtained credit from the individual or organisation. Legal safeguards are put in place to ensure that rights of creditors are not negatively affected by a company transaction."
"cbcm:CreditorExitRight","Creditor exit right","The creditors right to be paid out and therefore to exit the company in the context of a transaction."
"cbcm:CreditorInformationRight","Creditor information right","The information rights of creditors in the context of a company transaction, which includes for instance access to documents."
"cbcm:CreditorSecurityRight","Creditor security right","Member States shall provide for an adequate system of protection of the interest of creditors, and shall ensure that creditors who are dissatisfied with the safeguards offered in the draft terms of the transaction, as provided for in Article 86d (1) point (f), may apply to the appropriate administrative or judicial authority for adequate safeguards provided that they can credibly demonstrate that due to the transaction the satisfaction of their claims is at stake and that no adequate safeguards have been obtained from the company."
"cbcm:CrossBorderConversion","Cross-border conversion","A cross-border conversion is an operation through which a company, formed in one country (with the EU/EEA set of countries) is converted into a company governed by the law of another."
"cbcm:PreConversionCertificate","Company pre-conversion certificate","Article 86m: a pre-conversion certificate attests compliance with all the relevant conditions and the proper completion of all procedures and formalities in the departure Member State."
"cbcm:CrossBorderDivision","Cross-border company division","A company which in a process of the cross-border division in case of a full division transfers all its assets and liabilities to two or more companies, or in case of a partial division or division by separation transfers part of its assets and liabilities to one or more companies. The companies involved in the process are located in multiple (two or more) distinct countries."
"cbcm:CrossBorderMerger","Cross-border merger","A cross border merger involves at least one company based in an EU Member State and one company that is registered elsewhere within the European Union and is leading to a universal transfer of assets and liabilities from the merging company to the acquiring company."
"cbcm:CrossBorderMergerByAcquisition","Cross-border company merger by acquisition","Article 89: The operation whereby one or more companies are wound up without going into liquidation and transfer to another all their assets and liabilities in exchange for the issue to the shareholders of the company or companies being acquired of shares in the acquiring company and a cash payment, if any, not exceeding 10 % of the nominal value of the shares so issued or, where they have no nominal value, of their accounting par value. Companies involved come from two or more distinct countries."
"cbcm:CrossBorderMergerIntoNewCompany","Cross-border merger into a new company","Article 90: the operation whereby several companies are wound up without going into liquidation and transfer to a company that they set up all their assets and liabilities in exchange for the issue to their shareholders of shares in the new company and a cash payment, if any, not exceeding 10 % of the nominal value of the shares so issued or, where they have no nominal value, of their accounting par value. Companies involved come from two or more distinct countries."
"cbcm:CrossBorderSeatTransfer","Cross-border company seat transfer","The act of changing the location where the company’s business was managed (registered office or headquarters) or the place where that company’s primary business was actually conducted (central administration), across national boundaries."
"cbcm:DataCurationActivity","Data curation activity","A data curation activity represents a researcher's involvement in annotating cross border transactions"
"cbcm:DecisionRight","Shareholder decision right","The shareholders can take a number of decisions affecting the company, such as amending the company's articles of association, appointing or dismissing board members and to approve important transactions (e.g. mergers, divisions and conversions/seat transfers). These are taken through a shareholder resolution."
"cbcm:ShareholderRight","Shareholder right","The rights of shareholders of a company in the context of a transaction. Often, shreholder resolutions are used to effectuate shareholder rights. Many rights are laid down in the so-called Shareholder Rights Directive."
"cbcm:DivisionCertificate","Company division certificate","A document issued by a Competent Authority declaring that the legally required steps of a division are completed. The certificate needs to be presented by a company to either be registered (or register a newly established emerging/recipient company) in another company registry or to be removed from a company register."
"cbcm:DomesticConversion","Domestic company conversion","A domestic conversion is an operation through which a company's form is converted into a another while still remaining governed by the same law as the original company. For instance, the modification of a company's form from a public to a private limited company."
"cbcm:DomesticDivision","Company domestic division","A company which in a process of the domestic division - in case of a full division - transfers all its assets and liabilities to two or more companies, or - in case of a partial division or division by separation - transfers part of its assets and liabilities to one or more companies. All companies involved in the process are located in a single country."
"cbcm:DomesticMerger","Company domestic merger","A domestic merger involves at least two companies based in the same EU Member State and is leading to a universal transfer of assets and liabilities from the merging company to the acquiring company."
"cbcm:DomesticMergerByAcquisition","Domestic company merger by acquisition","Article 89: The operation whereby one or more companies are wound up without going into liquidation and transfer to another all their assets and liabilities in exchange for the issue to the shareholders of the company or companies being acquired of shares in the acquiring company and a cash payment, if any, not exceeding 10 % of the nominal value of the shares so issued or, where they have no nominal value, of their accounting par value. All companies involved are from a single country."
"cbcm:DomesticMergerIntoNewCompany","Domestic merger into a new company","Article 90: the operation whereby several companies are wound up without going into liquidation and transfer to a company that they set up all their assets and liabilities in exchange for the issue to their shareholders of shares in the new company and a cash payment, if any, not exceeding 10 % of the nominal value of the shares so issued or, where they have no nominal value, of their accounting par value. All companies involved are from a single country."
"cbcm:DomesticSeatTransfer","Domestic company seat transfer","The act of changing the location where the company’s business was managed (registered office or headquarters) or the place where that company’s primary business was actually conducted (central administration), within a specific country."
"cbcm:EEACountry","European Economic Area country","Created in 1994, the European Economic Area (EEA) combines the countries of the European Union (EU) and member countries of the European Free Trade Association (EFTA) to facilitate participation in the European Market trade and movement without having to apply to be one of the EU member countries"
"cbcm:NonEEACountry","Non-EEA country","A country which does not belong to the European Economic Area (EEA)."
"cbcm:EUCountry","EU country","A country which forms part of the European Union. The European Union is a conglomeration of European countries whose governance structures agree to abide with common political and economic criteria to improve efficiency of goods and services trading as well as movement and migration of inhabitants between these countries"
"cbcm:NonEUCountry","Non-EU country","A country that does not officially belong to the EU conglomeration"
"cbcm:FinancialServiceAuthority","Financial service authority","A body that regulates the financial services industry in a country (e.g. the UK), including most financial services markets, exchanges and firms."
"cbcm:GlobalUltimateOwner","Global ultimate owner","A global ultimate owner (GUO) is the individual or entity at the top of the corporate ownership structure."
"cbcm:ImpactOnEmploymentRight","Impact on employment information right","The right of employees or their representatives to be informed on the likely repercussions of the cross-border transaction on employment, which includes the dismissal as well as the hiring of employees or relocation of work. See for instance article 122 of Directive 2017/1132."
