"ontology_term","ontology_term_label","ontology_term_definition"
"cbcm:lawfirm","Law Firm","Name of the lawfirm involved in the transaction, if available (for internal use; cross-border divisions and seat transfers are currently not possible within an EU legal framework.)"
"cbcm:legalFormAcronym","Legal form acronym","The acronym of a company legal form"
"cbcm:mcEmploymentFigureAtTransaction","MC Employees count at transaction","Number of employees of the acquiring company - at the moment of the transaction"
"cbcm:mcLastEmploymentFigure","Last employment figure for the merging company","The last available annual employment figure for the merging company"
"cbcm:mcYearEmploymentFigure","MC Last employment figure year","The year the last annual employment figure was obtained for merging companies"
"cbcm:multiCBM","Multi-transaction","A transaction whereby more than two companies (i.e. multiple merging companies) are involved and merged into one acquiring company"
"cbcm:naceCode","NACE code","NACE Classification Code for companies. NACE (Nomenclature des Activités Économiques dans la Communauté Européenne) is a European industry standard classification system similar in function to Standard Industry Classification (SIC) and North American Industry Classification System (NAICS) for classifying business activities. From EUROSTAT"
"cbcm:naceSector","NACE sector","Company NACE sector. NACE (Nomenclature of Economic Activities) is the European statistical classification of economic activities. Classification of a company according to which kinds of sector (i.e. industry / market / product type) they deal in. From EUROSTAT"
"cbcm:name","Organization name","The name of the organization"
"cbcm:natRegistrationNumber","NAT registration number","The national registration number of an acquiring/receiving/entry company. A company registration number is a unique combination of numbers and/or letters. It is used to identify a company and verify its legal existence as an incorporated entity."
"cbcm:negotiatedAgreement","Has negotiated agreement","Is the management of the companies involved starting the process of setting up a Special Negotiating Body (SNB) in order to reach a negotiated agreement on the future employee participation mechanism (BLER) after the transaction?

BLER (Board-Level Employee Represenation): highest level of employee involvement in a company in the supervisory board. They can take co-determine decisions of the company's management and where the company is heading.

- Yes: there is a negotiated agreement to be negotiated with the SNB;
- No: no negotiated agreement;
- Not applicable: the conditions are not met (e.g. no employees, BLER threshold not met) for this criterion to be applicable;
- Unclear: the wording of the document is unclear with regard to the impact/effect/measures taken;
- Not mentioned: given the parameters, this aspect should be addressed in the transaction document, but is not mentioned"
"cbcm:rawTransactionID","Raw transaction ID","unique identifier before database entry.

This id is the old ID-structure used before entry into the CbCMdb"
"cbcm:registeredOffice","Registered Office","Deprecated property"
"cbcm:sbnVoluntaryApplication","SNB voluntary application","Is a Special Negotiating Body (SNB) set up voluntary?

Whether or not a SNB is created/will be created voluntarily.

- Yes: an SNB is created voluntarily;
- No: no voluntary SNB set up;
- Not applicable: the conditions are not met (e.g. no employees, BLER threshold not met) for this criterion to be applicable;
- Unclear: the wording of the document is unclear with regard to the impact/effect/measures taken;
- Not mentioned: given the parameters, this aspect should be addressed in the transaction document, but is not mentioned"
"cbcm:standardRulesApplication","Standard rules application","Are the standard rules applied directly without and instead of the start of negotiations with a Special Negotiating Body (SNB)?

Instead of an SNB being set up, the standard rules are applied instead.

- Yes: the standard rules are applied;
- No: standard rules ar enot applied;
- Not applicable: the conditions are not met (e.g. no employees, BLER threshold not met) for this criterion to be applicable;
- Unclear: the wording of the document is unclear with regard to the impact/effect/measures taken;
- Not mentioned: given the parameters, this aspect should be addressed in the transaction document, but is not mentioned"
"cbcm:tnic","Has TNIC","Is the company having a transnational information and consultation agreement in place? Does the company have an internal body which discusses employee rights and welfare?

Different from works council. TNIC is global."
"cbcm:toBeNegotiatedBLER","BLER to be negotiated","Is an employee board level representation/participation (BLER) mechanism going to be re-negotiated in the process of the cross-border transaction?

- Yes: BLER be (re-)negotiated with the SNB;
- No: no BLER-(re-)negotiation;
- Not applicable: the conditions are not met (e.g. no employees, BLER threshold not met) for this criterion to be applicable;
- Unclear: the wording of the document is unclear with regard to the impact/effect/measures taken;
- Not mentioned: given the parameters, this aspect should be addressed in the transaction document, but is not mentioned"
"cbcm:transactionComment","Transaction comment","Notes from researcher about the transaction"
"cbcm:transactionCompletionDate","Transaction completion date","Date on which the transaction was effectuated (the date that the competent authority e.g., business registry of that country, says that the criteria have been met by merging and acquiring companies and the merging/transferring company is dissolved).

This is the final step of a transaction process"
"cbcm:transactionID","Transaction ID","unique identifier for a transaction"
"cbcm:transactionPlan","Transaction plan available","Is the transaction plan available for analysis?

Merger plan, Seat transfer plan or Division plan. Transaction notice is where the transaction is announced. The other documents are where the nature and details of the transaction are specified."
"cbcm:transactionStartDate","Transaction notice date","Date of the transaction notice (document announcing the transaction) constituting the start of the transaction process. Date that the document was published (which is the important date because this is when it becomes legally binding)"
"cbcm:website","Website","Homepage of a company/organization website"
"cbcm:wwEmploymentFigureAtTransaction","Total WW employees at transaction","number of employees of company group worldwide at the moment of the transaction"
"cbcm:yearDivergingEmploymentFigure","Diverging employment figure year","The year for which a diverging employee number is recorded"
"cbcm:yearWWEmploymentFigure","Last WW employment figure year","Year in which the last worldwide employment figure was recorded"
